{"schema_version":"1","task_id":"mcp-integration","phase_instance":"phase-impl-2","step":"adjudicate","subject_digest":"aaaaaaaaaaaaaaaaaaaaaaaaaaaaaaaaaaaaaaaaaaaaaaaaaaaaaaaaaaaaaaaa","input_fingerprint":"bbbbbbbbbbbbbbbbbbbbbbbbbbbbbbbbbbbbbbbbbbbbbbbbbbbbbbbbbbbbbbbb","pinned_constitution_digest":"cccccccccccccccccccccccccccccccccccccccccccccccccccccccccccccccc","approved_upstream_digests":["dddddddddddddddddddddddddddddddddddddddddddddddddddddddddddddddd"],"source_evidence_set_digest":"eeeeeeeeeeeeeeeeeeeeeeeeeeeeeeeeeeeeeeeeeeeeeeeeeeeeeeeeeeeeeeee","rule_findings":[{"rule_id":"safe-paths","rule_version":2,"compliance":"pass","rationale":"Current evidence confirms compliance.","trigger":"not-matched","trigger_evidence":"No unsafe path was observed.","enforced_by":[{"mechanism":"path-contract","state":"current","subject_digest":"aaaaaaaaaaaaaaaaaaaaaaaaaaaaaaaaaaaaaaaaaaaaaaaaaaaaaaaaaaaaaaaa","evidence_digest":"ffffffffffffffffffffffffffffffffffffffffffffffffffffffffffffffff","details":"Contract suite passed."}]}],"drift_findings":[{"upstream_digest":"dddddddddddddddddddddddddddddddddddddddddddddddddddddddddddddddd","drift":"aligned","affected_claim_ids":[],"rationale":"Implementation follows the approved design."}],"constitution":"pass","drift":"aligned","matched_rule_versions":[],"uncertain_rule_versions":[]}
